{
  "schemaVersion": "sapphirus.model-context-consent.v1",
  "decisionId": "decision_01J00000000000000000000000",
  "requestId": "request_01J00000000000000000000000",
  "invocationId": "invoke_01J00000000000000000000000",
  "deliveryModel": "windows_local",
  "tenantHash": "sha256:1111111111111111111111111111111111111111111111111111111111111111",
  "subjectHash": "sha256:2222222222222222222222222222222222222222222222222222222222222222",
  "registrationId": "dreg_01J00000000000000000000000",
  "installationPublicKeyHash": "sha256:3333333333333333333333333333333333333333333333333333333333333333",
  "entitlementLeaseId": "lease_01J00000000000000000000000",
  "entitlementLeaseHash": "sha256:4444444444444444444444444444444444444444444444444444444444444444",
  "tenantPolicyId": "policy_01J00000000000000000000000",
  "tenantPolicyVersion": 7,
  "tenantPolicyHash": "sha256:5555555555555555555555555555555555555555555555555555555555555555",
  "purpose": "bmad_help",
  "modelRole": "planner",
  "canonicalOutputSchemaId": "sapphirus.bmad-method-help-proposal.v1",
  "canonicalOutputSchemaHash": "sha256:6666666666666666666666666666666666666666666666666666666666666666",
  "manifestHash": "sha256:7777777777777777777777777777777777777777777777777777777777777777",
  "invocationBindingHash": "sha256:8888888888888888888888888888888888888888888888888888888888888888",
  "consumptionHash": "sha256:9999999999999999999999999999999999999999999999999999999999999999",
  "consentDisclosureHash": "sha256:aaaaaaaaaaaaaaaaaaaaaaaaaaaaaaaaaaaaaaaaaaaaaaaaaaaaaaaaaaaaaaaa",
  "providerProfileHash": "sha256:bbbbbbbbbbbbbbbbbbbbbbbbbbbbbbbbbbbbbbbbbbbbbbbbbbbbbbbbbbbbbbbb",
  "modelProfileHash": "sha256:cccccccccccccccccccccccccccccccccccccccccccccccccccccccccccccccc",
  "modelCapabilityHash": "sha256:dddddddddddddddddddddddddddddddddddddddddddddddddddddddddddddddd",
  "deploymentHash": "sha256:eeeeeeeeeeeeeeeeeeeeeeeeeeeeeeeeeeeeeeeeeeeeeeeeeeeeeeeeeeeeeeee",
  "region": "westeurope",
  "retentionMode": "transient_no_store",
  "budgetClass": "interactive-standard",
  "issuedAt": "2026-07-16T10:00:00.000Z",
  "notBefore": "2026-07-16T10:00:00.000Z",
  "expiresAt": "2026-07-16T10:05:00.000Z",
  "nonceHash": "sha256:ffffffffffffffffffffffffffffffffffffffffffffffffffffffffffffffff",
  "consentEnvelopeHash": "sha256:0000000000000000000000000000000000000000000000000000000000000000",
  "proof": {
    "proofType": "installation_signature",
    "algorithm": "ES256",
    "keyId": "installation-key-2026-07",
    "signedPayloadHash": "sha256:0000000000000000000000000000000000000000000000000000000000000000",
    "signature": "ZXhhbXBsZS1kZXZpY2Utc2lnbmF0dXJl"
  }
}
